commit	group_commit_throughput	append_consistent_p99_ns	e2e_p50_ns	e2e_p99_ns	memory_kb	group_commit_throughput_prealloc	fsync_only_p50_ns	fsync_prealloc_p50_ns	write_only_p50_ns	status	description
2249b81	59701.72	566379	0	823101	0	0	0	0	0	keep	baseline champion (no change): group_commit_throughput=59701.7/s, append_consistent_p99=566379ns, gate e2e_p99=823101ns PASS, torture green
1582f07	43916	448667	0	0	0	0	0	0	0	discard	Arc<[u8]> shared payload (eliminate 2nd per-append Vec alloc): primary median-of-5=43916/s vs champ 59701 (NO improvement; samples 37627-62951, +-2x sandbox noise, distributions overlap); append_p99 improved 448667 vs 566379; gate auto-skipped (not plausible); reverted
53dfe44	51505	454996	453384	841085	0	0	0	0	0	keep	re-baseline champion under p50 median-of-N gate: primary median-of-7=51505/s (samples 38990-69163, +-30% host noise); append_consistent_p99=454996ns; gate e2e_p50=453384ns e2e_p99=841085ns PASS. Establishes p50 gate baseline (pre-rework rows have e2e_p50=0); champion journal code unchanged from 2249b81
fec3094	62341	558308	455897	800221	0	0	0	0	0	keep	fsync re-drain coalescing (writer_loop Consistent arm: re-drain channel after write_batch, before fsync, up to 4 rounds; one fsync covers original batch + newcomers): primary median-of-7=62341/s vs champ 51505 (+21%; samples 57660-77894, candidate min>champ median, distributions cleanly separated); gate e2e_p50=455897 vs 453384 (+0.55%, flat) PASS; append_p99 558308 (secondary, noisy); 96 journal tests + torture green
4fcb939	195408	850079	447514	799639	0	0	0	0	0	keep	dup-fd fsync: fsync a try_clone'd fd, release state.lock across sync_all so producers enqueue during the fsync window; re-drain then coalesces the whole backlog into the next fsync. primary median-of-7=195408/s vs champ 62341 (+213%; samples 182272-224378, candidate min 182272 = 2.6x champ max, distributions fully disjoint); gate e2e_p50=447514 vs 455897 (-1.8%, improved) e2e_p99=799639 (flat) PASS; append_consistent_p99=850079 (secondary, up from larger batches; cluster e2e p99 flat); journal crash/truncation/durability suite + frozen torture green
4fcb939	205396	607887	453574	781315	0	0	0	0	0	discard	encode/CRC32 outside state.lock (split append_records into encode + write_encoded; off-lock crc32fast pass into reusable scratch buffer; lock only for fence/rotation/seek/write_all): primary median-of-7=205396/s vs champ 195408 (WASH, +5% within noise; candidate 187-216k overlaps champ 182-224k); append_p99 median-of-7=607887 vs champ single 850079 (modest ~28% but noisy, candidate spans 526-799k); gate e2e_p50=453574 (+1.35%) e2e_p99=781315 PASS; full journal durability suite green. DISCARD: no robust primary gain to justify added complexity. NOTE latency signal worth a future latency-primary campaign
4fcb939	197882	597723	454836	817714	0	0	0	0	0	discard	spin-before-park in Notifier::wait (lock-free AtomicBool done, 4096-iter spin_loop budget before condvar park; profiler said path is 79.7%-futex/park-bound, ~28us park vs ~free fsync): primary median-of-7=197882/s vs champ 195408 (WASH, +1.3% within noise; 185-204k overlaps champ 182-224k); append_p99 median-of-7=597723 vs champ ~608k (WASH); gate e2e_p50=454836 (+1.6%) PASS; full durability/concurrency suite green. DISCARD: wash on both metrics + busy-spin burns CPU (antisocial on shared host). group_commit parks only 1x/256-burst so park cost is amortized away; real per-burst cost is elsewhere (state.lock held across write_all)
4fcb939	194927	577054	0	0	0	0	0	0	0	discard	write_all off the state lock (pwrite write_all_at on dup'd fd outside state.lock; encode+offset capture under lock, write unlocked, reacquire to advance size/index/pending/hwm; orphan-tail set_len repair guards a truncate-shrink race that would re-extend into a Corrupted zero-hole): primary median-of-7=194927/s vs champ 195408 (WASH, -0.2%; 183-248k fully overlaps champ 182-224k); append_p99 median-of-7=577054 (~5% vs ~608k, noise); single microbench 184092 tripped gate plausibility skip; full durability suite + truncate-race x8 + frozen torture green. DISCARD: 3rd consecutive contention/sync lever to wash -> group_commit primary is NOT state-lock-bound on this VM; profiler's VM-scheduling-bound verdict confirmed. Most complexity+correctness surface of any change for zero primary gain
680a104	76394	1822082	0	0	0	128685	898497	383942	20039	keep	journal stage-isolation + preallocation re-test instrumentation (no champion code change; adds write_only/fsync_only/fsync_prealloc + group_commit_throughput_prealloc metrics, exercising the real preallocate_segments flag via bench-support): median-of-15 on a LOADED sandbox host. preallocate_segments halves the per-commit fsync barrier (fsync_only p50 898497ns -> fsync_prealloc 383942ns, -57%) and lifts group-commit throughput 76394 -> 128685/s (+66%) by dropping the i_size/extent-map (jbd2) metadata commit a size-extending append forces; write-only page-cache append p50=20039ns. e2e Gate B not run (instrumentation-only row, absolutes inflated by host load). 110 journal tests + microbench_smoke green; perf/check 16 metrics within tolerance
